UxBet,Flamengo x Fluminense | Carioca,Flamengo vence + Mais de 1.5 gols na partida
UxBet,Bahia x Vitória | Campeonato Baiano,CHANCE DUPLA: Vitória ou Empate + Ambas equipes marcam
UxBet,Palmeiras x Corinthians | Paulistão,DUPLA CHANCE: Corinthians ou Empate + Memphis marca ou dá assistência
UxBet,Atlético de Madrid x Barcelona | La Liga,Ambas equipes marcam
UxBet,Atlético de Madrid x Barcelona | La Liga,Ambas equipes marcam + Julian Álvarez marca a qualquer momento
Faz1Bet,Palmeiras - Corinthians SP,Resultado: Corinthians / Yuri Alberto e Memphis Depay têm mais de 0.5 chutes ao gol cada.
Faz1Bet,Palmeiras - Corinthians SP,Resultado: Palmeiras / Vitor Roque e Raphael Veiga têm mais de 1.5 chutes ao gol cada.
Faz1Bet,Arsenal - Chelsea,Mais de 2.5 escanteios primeiro tempo para o Arsenal/ Maior numero de escanteios na partida: Arsenal/ Resultado: Arsenal ou empate
Faz1Bet,Leicester - Manchester United,Jamie Vardy e Bruno Fernandes Mais de 0.5 chutes ao cada/ Manchester United ou empate
Faz1Bet,Atalanta - Inter Milan,ambos marcam e ambas equipes recebem 2 ou mais cartões na partida
Faz1Bet,Atalanta - Inter Milan,Atalanta ou empate / Lookman e Lautaro Martinez Mais de 0.5 chutes ao gol cada um
Faz1Bet,Flamengo RJ - Fluminense RJ,Resultado: Flamengo / Ambos os times marcam / Mais escanteios: Flamengo
Faz1Bet,Flamengo RJ - Fluminense RJ,Resultado: Empate ou Fluminense / Ambos os times recebem mais de 1.5 cartões cada.
BetFast,Palmeiras - Corinthians SP,Resultado: Palmeiras / Mais de 2.5 gols na partida / Palmeiras tem o maior número de escanteios.
BetFast,Flamengo RJ - Fluminense RJ,Resultado: Flamengo / Ambas marcam / Ambas as equipes recebem mais de 1.5 cartões cada.
BetFast,Atletico Madrid - Barcelona,Julian Alvarez e Raphinha mais de 0.5 chutes ao gol cada/ ambos times recebem 2 ou mais cartões
BetFast,Atletico Madrid - Barcelona,Atletico de Madrid ou empate/ Mais finalizações: Barcelona / Mais escanteios : Barcelona
BetFast,Atalanta - Inter Milan,inter de milão ou empate / Calhanoglu Mais de 0.5 chutes ao gol
BetFast,Liverpool - Newcastle,Resultado Liverpool / Mais de 9.5 escanteios/ Mais de 2.5 gols
BetFast,Liverpool - Newcastle,Empate ou Newcastle / ambos times recebem 2 ou mais cartões na partida
UxBet,Clássicos | Finais,"Internacional x Grêmio (Campeonato Gaúcho), Flamengo x Fluminense (Campeonato Carioca), Vila Nova x Goiás (Campeonato Goiano), Bahia x Vitória (Campeonato Baiano), Palmeiras x Corinthians (Campeonato Paulista) - Mais de 0.5 faltas nas partidas"
UxBet,Internacional x Grêmio | Gaúchão,Internacional vence a partida + Mais de 1.5 gols na partida
UxBet,Internacional x Grêmio | Gaúchão,CHANCE DUPLA: Grêmio ou Empate + Mais de 2.5 gols na partida
UxBet,Flamengo x Fluminense | Carioca,CHANCE DUPLA: Fluminense ou Empate + Ambas equipes marcam
UxBet,Bahia x Vitória | Campeonato Baiano,Bahia vence + Mais de 1.5 gols para Bahia
UxBet,Palmeiras x Corinthians | Paulistão,Vitor Roque marca a qualquer momento
UxBet,Palmeiras x Corinthians | Paulistão,Palmeiras vence + Ambas equipes marcam
UxBet,Atlético de Madrid x Barcelona | La Liga,Barcelona vence + Mais de 1.5 gols na partida
BETESPORTE,SUPERodd,"Arsenal, Juventus e Liverpool (tempo normal) para vencerem seus jogos"
BETESPORTE,SUPERodd,Liverpool para ser campeão e Salah para marcar no tempo normal
BETESPORTE,SUPERodd,Corinthians e Flamengo para vencerem seus jogos no tempo normal
BETESPORTE,SUPERodd,"Internacional, Palmeiras e Vila Nova para vencerem seus jogos no tempo normal"
BETESPORTE,SUPERodd,Flamengo para vencer o Fluminense e Arrascaeta para marcar no tempo normal
BETESPORTE,SUPERodd,TÊNIS: Thiago Monteiro para vencer Daniel Elahi Galan Sem perder um Set
BETESPORTE,SUPERodd,Barcelona para vencer o Atlético Madri e Lewandowisk para marcar
BETESPORTE,SUPERodd,TÊNIS: João Fonseca e Jack Draper para vencerem seus jogos Sem perder um Set
BETESPORTE,SUPERodd,Palmeiras para vencer o Corinthians e Estevão para marcar
BETESPORTE,SUPERodd,NBA: Bucks para vencer o Thunder e Giannis Antetokounmpo para marcar + de 30 Pontos
BetFast,Palmeiras - Corinthians SP,Mais de 0.5 cartões vermelhos na partida.
BetFast,Palmeiras - Corinthians SP,Resultado: Empate e Mais de 9.5 escanteios na partida.
BetFast,Palmeiras - Corinthians SP,Resultado: Empate ou Corinthians vence / Estevão e Yuri Alberto têm mais de 0.5 chutes ao gol cada.
BetFast,Palmeiras - Corinthians SP,Palmeiras marca em ambos os tempos / Jose Flaco Lopez e Facundo Torres têm mais de 0.5 chutes ao gol cada.
BetFast,Flamengo RJ - Fluminense RJ,Resultado: Empate ou Fluminense / Mais de 0.5 Gol para o Fluminense.
BetFast,Atletico Madrid - Barcelona,"Mais de 3.5 Chutes ao gol pelo trio de ataque do Barcelona (Lamine Yamal, Raphinha e Robert Lewandowki)"
BetFast,Atletico Madrid - Barcelona,"Menos de 3.5 Chutes ao gol pelo trio de ataque do Barcelona (Lamine Yamal, Raphinha e Robert Lewandowki)"
BetFast,Atletico Madrid - Barcelona,"Mais de 9.5 Finalizações pelo trio de ataque do Barcelona (Lamine Yamal, Raphinha e Robert Lewandowki)"
BetFast,Atletico Madrid - Barcelona,"Menos de 9.5 Finalizações pelo trio de ataque do Barcelona (Lamine Yamal, Raphinha e Robert Lewandowki)"
BetFast,Atletico Madrid - Barcelona,Resultado: Atletico de Madrid / Julian Alvarez Mais de 1.5 chutes ao gol
BetFast,Atletico Madrid - Barcelona,Ambos goleiros Mais de 2.5 defesas cada um
BetFast,Arsenal - Chelsea,Resultado: Arsenal /Cole Palmer e Gabriel Martinelli Mais de 0.5 chutes ao gol cada
BetFast,Fulham - Tottenham Hotspur,Ambos times marcam e ambos times recebem 2 ou mais cartões na partida
BetFast,Leicester - Manchester United,Mais de 3.5 defesas do Goleiro do Leicester e Mais de 1.5 faltas do Bruno fernandes
BetFast,Atalanta - Inter Milan,Resultado: Inter de Milão / Mais Finalizações : Inter de Milão
BetFast,PSG - Marseille,"Mais de 4.5 Chutes ao gol pelo trio de ataque do PSG (Ousmane Dembélé, Khvicha e Bradley Barcola)"
BetFast,PSG - Marseille,"Menos de 4.5 Chutes ao gol pelo trio de ataque do PSG (Ousmane Dembélé, Khvicha e Bradley Barcola)"
BetFast,PSG - Marseille,"Mais de 7.5 Finalizações pelo trio de ataque do PSG (Ousmane Dembélé, Khvicha e Bradley Barcola)"
BetFast,PSG - Marseille,"Menos de 7.5 Finalizações pelo trio de ataque do PSG (Ousmane Dembélé, Khvicha e Bradley Barcola)"
BetFast,Liverpool - Newcastle,"Mais de 3.5 Chutes ao gol pelo trio de ataque do Liverpool (Mohamed Salah, Darwin Núñez e Luis Diaz)"
BetFast,Liverpool - Newcastle,"Menos de 3.5 Chutes ao gol pelo trio de ataque do Liverpool (Mohamed Salah, Darwin Núñez e Luis Diaz)"
BetFast,Liverpool - Newcastle,"Over 5.5Mais de 5.5 Finalizações pelo trio de ataque do Liverpool (Mohamed Salah, Darwin Núñez e Luis Diaz)total shots by Liverpool's attacking trio (Mohamed Salah, Darwin Núñez, and Luis Diaz)."
BetFast,Liverpool - Newcastle,"Menos de 5.5 Finalizações pelo trio de ataque do Liverpool (Mohamed Salah, Darwin Núñez e Luis Diaz)"
BETPIX365,Fulham - Tottenham,Fulham para vencer
BETPIX365,Internacional - Gremio,Para ambas marcarem - sim
BETPIX365,Flamengo - Fluminense,Para ambas marcarem - sim
BETPIX365,Atl. Madrid - Barcelona,Barcelona para ganhar
BRBET,Atl. Madrid - Barcelona,Mais de 0.5 Faltas na Partida
VAIDEBET,Arsenal - Chelsea,Arsenal para ganhar
VAIDEBET,Leicester - Man Utd,Man Utd para ganhar
VAIDEBET,Flamengo - Fluminense,Mais de 2.5 Gols
VAIDEBET,Palmeiras - Corinthians,Mais de 2.5 Gols
Faz1Bet,Arsenal - Chelsea,Resultado: Arsenal /Cole Palmer e Gabriel Martinelli Mais de 0.5 chutes ao gol cada
Faz1Bet,Atletico Madrid - Barcelona,"Mais de 3.5 Chutes ao gol pelo trio de ataque do Barcelona (Lamine Yamal, Raphinha e Robert Lewandowki)"
Faz1Bet,Atletico Madrid - Barcelona,"Menos de 3.5 Chutes ao gol pelo trio de ataque do Barcelona (Lamine Yamal, Raphinha e Robert Lewandowki)"
Faz1Bet,Atletico Madrid - Barcelona,"Mais de 9.5 Finalizações pelo trio de ataque do Barcelona (Lamine Yamal, Raphinha e Robert Lewandowki)"
Faz1Bet,Atletico Madrid - Barcelona,"Menos de 9.5 Finalizações pelo trio de ataque do Barcelona (Lamine Yamal, Raphinha e Robert Lewandowki)"
Faz1Bet,PSG - Marseille,"Mais de 4.5 Chutes ao gol pelo trio de ataque do PSG (Ousmane Dembélé, Khvicha e Bradley Barcola)"
Faz1Bet,PSG - Marseille,"Menos de 4.5 Chutes ao gol pelo trio de ataque do PSG (Ousmane Dembélé, Khvicha e Bradley Barcola)"
Faz1Bet,PSG - Marseille,"Mais de 7.5 Finalizações pelo trio de ataque do PSG (Ousmane Dembélé, Khvicha e Bradley Barcola)"
Faz1Bet,PSG - Marseille,"Menos de 7.5 Finalizações pelo trio de ataque do PSG (Ousmane Dembélé, Khvicha e Bradley Barcola)"
ESTRELABET,Partida,Finais Estaduais: Para ter ao menos um escanteio em cada jogo das finais do Cariocão e Paulistão deste Domingo 16/03.
Faz1Bet,Liverpool - Newcastle,Resultado: Liverpool / Mais de 0.5 chutes ao gol Salah e Alexander Isak cada um
Faz1Bet,Liverpool - Newcastle,Ambos marcam e Newcastle para ser Campeão
Faz1Bet,Liverpool - Newcastle,Bruno Guimarães mais de 2.5 desarmes /Goleiro do Liverpool Mais de 1.5 defesas / ambos times recebem cartão
Faz1Bet,Liverpool - Newcastle,"Mais de 3.5 Chutes ao gol pelo trio de ataque do Liverpool (Mohamed Salah, Darwin Núñez e Luis Diaz)"
Faz1Bet,Liverpool - Newcastle,"Menos de 3.5 Chutes ao gol pelo trio de ataque do Liverpool (Mohamed Salah, Darwin Núñez e Luis Diaz)"
Faz1Bet,Liverpool - Newcastle,"Over 5.5Mais de 5.5 Finalizações pelo trio de ataque do Liverpool (Mohamed Salah, Darwin Núñez e Luis Diaz)total shots by Liverpool's attacking trio (Mohamed Salah, Darwin Núñez, and Luis Diaz)."
Faz1Bet,Liverpool - Newcastle,"Menos de 5.5 Finalizações pelo trio de ataque do Liverpool (Mohamed Salah, Darwin Núñez e Luis Diaz)"
