BrasilDaSorte,CRB AL x Ferroviário AC CE,Mais de 2.5 gols na partida / Mais de 9.5 escanteios no jogo
BrasilDaSorte,Daniil Medvedev x Jaume Munar,Daniil Medvedev ganhar por 2 x 0 / 1º Set - Total de Games - Mais/Menos: -9.5 games / Mais de 1.5 Quebras de Saque no 1° Set
BrasilDaSorte,Uruguai x Argentina,1º tempo - Chance dupla: Argentina ou Empate / Gols - Mais/Menos: +2.5 gols / Total de escanteios: +7.5 escanteios
BrasilDaSorte,Super Sorte do Dia,*Roménia x Bósnia: Multi resultados: 2x1 ou 3x1 ou 4x1 / *Polónia x Lituânia: Multi resultados: 2x1 ou 3x1 ou 4x1 / *Inglaterra x Albânia: Gols - Mais/Menos: +2.5 gols / *Uruguai x Argentina: Argentina Vence
BrasilDaSorte,Irlanda do Norte x Suíça,Tempo Regular - Suíça / Total de gols(Suíça): +1.5 gols / Total de escanteios: +7.5 escanteios
BrasilDaSorte,Irlanda do Norte x Suíça,Tempo Regular - Suíça / Total de gols(Suíça): +1.5 gols / Total de escanteios: +7.5 escanteios
BrasilDaSorte,Polónia x Lituânia,Tempo Regular - Polónia / Total de gols(Polónia): +2.5 gols / Total de escanteios (Polónia): +5.5 escanteios
BrasilDaSorte,Polónia x Lituânia,Tempo Regular - Polónia / Total de gols(Polónia): +2.5 gols / Total de escanteios (Polónia): +5.5 escanteios
BrasilDaSorte,Roménia x Bósnia & Herzegovina,1º tempo - Gols - Mais/Menos: +0.5 gols / 1º tempo - Total de escanteios: Entre 0 e 4 / Tempo Regular - Roménia
BrasilDaSorte,Inglaterra x Albânia,"Inglaterra vence o 1º tempo e vence a partida / Total de escanteios: -8,5 escanteios"
BrasilDaSorte,Equador x Venezuela,Tempo Regular - Equador / Total de gols(Equador): +1.5 gols / Total de escanteios: +8.5 escanteios
BrasilDaSorte,Uruguai x Argentina,Chance Dupla: Argentina ou Empate
BrasilDaSorte,Super Sorte do Dia,*Liechtenstein x Macedónia do Norte: Liechtenstein ou Empate / *Moldávia x Noruega: Total de gols(Noruega): +2.5 gols / *Retro FC PE x Sport Clube do Recife: Retro FC PE Vence / *Avaí FC x Chapecoense SC: Avaí FC Vence
BrasilDaSorte,Super Sorte do Dia,*Liechtenstein x Macedónia do Norte: Tempo com mais gols: 1º tempo / *Montenegro x Gibraltar: Gols - Mais/Menos: +3.5 gols / *Israel x Estónia: Gols - Mais/Menos: +2.5 gols
BrasilDaSorte,República da Moldávia x Noruega,Tempo Regular - Noruega Vence / 1º tempo - Total de gols(Noruega): +0.5 gols / 1º tempo - Total de escanteios: Entre 0 e 4
BrasilDaSorte,Israel x Estónia,Tempo Regular - Israel Vence / Total de gols(Israel): +1.5 gols / Total de gols(Estónia): +0.5 gols
BrasilDaSorte,República Checa x Ilhas Faroé,1º tempo - Total de gols(República Checa): +0.5 gols / Multi resultados: 1x0 ou 2x0 ou 3x0
Faz1Bet,Washington Wizards - Orlando Magic,Orlando Magic faz mais de 111.5 pontos e vence a partida / Paolo Banchero e Franz Wagner marcam mais de 19.5 pontos cada
Faz1Bet,Miami Heat - Houston Rockets,Mais de 215.5 pontos / Tyler Herro e Jalen Green marcam mais de 19.5 pontos cada
Faz1Bet,San Antonio Spurs - Philadelphia 76ers,"Quentin Grimes, Devin Vassell e Harrison Barnes marcam acima de 1.5 cestas de três pontos cada"
Faz1Bet,Dallas Mavericks - Detroit Pistons,Detroit Pistons vence / Mais de 236.5 Pontos na partida
Faz1Bet,Utah Jazz - Boston Celtics,"Jayson Tatum, Derrick White e Kristaps Porzingis marcam Mais de 2.5 cestas de três pontos cada."
Faz1Bet,Portland Trail Blazers - Denver Nuggets. Phoenix Suns - Cleveland Cavaliers. LA Clippers - Memphis Grizzlies,"Cleveland Cavaliers, Denver Nuggets e Los Angeles Clippers vencem"
Faz1Bet,Uruguay - Argentina,Maior número de cartões: Argentina / Maior número de escanteios: Uruguai
Faz1Bet,Uruguay - Argentina,Resultado: Uruguai ou Empate / Brian Rodriguez e Darwin Nunez faz acima de 0.5 chutes ao gol
Faz1Bet,Germany - Italy,Mais de 6.5 defesas combinadas dos goleiros titulares.
Faz1Bet,France - Croatia,Mais de 6.5 defesas combinadas dos goleiros titulares.
Faz1Bet,Portugal - Denmark,Mais de 7.5 defesas combinadas dos goleiros titulares.
Faz1Bet,Portugal - Denmark,"Mais de 3.5 Chutes ao gol pelo trio de ataque de Portugal (Cristiano Ronaldo, Rafael Leão e Bruno Fernandes)"
Faz1Bet,Portugal - Denmark,"Menos de 3.5 Chutes ao gol pelo trio de ataque de Portugal (Cristiano Ronaldo, Rafael Leão e Bruno Fernandes)"
Faz1Bet,England - Albania,Dominic Solanke faz acima de 1.5 finalizações/ Maior número de finalizações e escanteios : Inglaterra / Maior número de cartões: Albânia
Faz1Bet,England - Albania,Inglaterra vence / Mais de 7.5 escanteios / Mais de 2.5 gols
BetFast,Utah Jazz - Boston Celtics,"Jayson Tatum marca mais de 24.5 pontos, registra mais de 9.5 rebotes e faz mais de 2.5 cestas de três pontos."
BetFast,Uruguai x Argentina,Uruguai vence e ambos os times recebem mais de 1.5 cartões cada.
BetFast,Inglaterra x Albânia,Inglaterra vence a partida e tem o maior número de chutes ao gol / Albânia recebe o maior número de cartões.
BetFast,Washington Wizards - Orlando Magic. Miami Heat - Houston Rockets. Dallas Mavericks - Detroit Pistons,"Pistons, Rockets e Magic vencem."
BetFast,Oklahoma City Thunder - Charlotte Hornets,Thunder vence e Shai Gilgeous-Alexander faz um duplo-duplo.
BetFast,San Antonio Spurs - Philadelphia 76ers,Devin Vassell e Quentin Grimes marcam mais de 2.5 cestas de três pontos cada.
BetFast,Phoenix Suns - Cleveland Cavaliers,Kevin Durant e Donovan Mitchell marcam mais de 24.5 pontos cada.
BetFast,LA Clippers - Memphis Grizzlies,"Clippers vence, James Harden marca mais de 22.5 pontos e registra mais de 6.5 assistências."
BetFast,Alemanha x Itália,Mais de 6.5 defesas combinadas dos goleiros titulares.
BetFast,França x Croácia,Mais de 6.5 defesas combinadas dos goleiros titulares.
BetFast,Portugal x Dinamarca,Mais de 7.5 defesas combinadas dos goleiros titulares.
BetFast,Portugal x Dinamarca,"Mais de 3.5 Chutes ao gol pelo trio de ataque de Portugal (Cristiano Ronaldo, Rafael Leão e Bruno Fernandes)"
BetFast,Portugal x Dinamarca,"Menos de 3.5 Chutes ao gol pelo trio de ataque de Portugal (Cristiano Ronaldo, Rafael Leão e Bruno Fernandes)"
BetFast,Germany - Italy,Empate ou Italia / Italia Mais de 10.5 finalizações /ambos times recebem 1 ou mais cartões na partida
BetFast,Germany - Italy,Ambos marcam / Ambos goleiros Mais de 2.5 defesas cada
BetFast,Spain - Netherlands,Resultado : Espanha / ambos goleiros Mais de 2.5 defesas cada
BetFast,Inglaterra x Albânia,Inglaterra vence e tem o maior número de escanteios / Harry Kane faz mais de 2.5 chutes ao gol.
BetFast,Vitoria BA - Bahia BA,Bahia vence / Mais de 9.5 escanteios e mais de 6.5 cartões na partida
BETPIX365,Eliminatórias América do sul - Copa do Mundo,Uruguai - Argentina - Argentina para vencer
BETPIX365,Eliminatórias América do sul - Copa do Mundo,Equador - Venezuela Mais de 2.5 gols
BETPIX365,"Qualificação do Campeonato do Mundo, Europa 2026",Israel - Estônia Para ambas marcarem - sim
Faz1Bet,Portugal - Denmark,Portugual vence / Maior número de cartões: Dinamarca / Maior número de finalizações: Portugal
Faz1Bet,Germany - Italy,Ambos marcam / Ambos goleiros Mais de 2.5 defesas cada
Faz1Bet,Germany - Italy,Resultado: Alemanha ou Empate / Ambos os times marcam / Mais de 2.5 gols
Faz1Bet,France - Croatia,França vence / Mais de 2.5 gols na partida e Kylian Mbappé marca um gol a qualquer momento
Faz1Bet,Spain - Netherlands,Maior número de cartões: Países Baixos / Maior número de Finalizações: Espanha / Lamine Yamal acima de 0.5 chutes aos gol
VAIDEBET,Eliminatórias América do sul - Copa do Mundo,Uruguai - Argentina Para ambas marcarem - sim
VAIDEBET,"Qualificação do Campeonato do Mundo, Europa 2026",Moldávia - Noruega Para ambas marcarem - sim
BetFast,France - Croatia,Resultado: França ou Empate / Ambas as equipes marcam / Kylian Mbappé marca um gol a qualquer momento.
BetFast,France - Croatia,Resultado: França / França Mais de 7.5 escanteios na partida
BetFast,Portugal - Denmark,Mais de 4.5 cartões e mais de 1.5 gols na partida / Resultado: Portugal ou Empate
BetFast,Chinese Grand Prix 2025 - Race,Gabriel Bortoleto terminar no Top 10.
BetFast,Espanha x Países Baixos,Resultado : Espanha / ambos goleiros Mais de 2.5 defesas cada
BetFast,França x Croácia,Resultado: França ou Empate / Ambas as equipes marcam / Kylian Mbappé marca um gol a qualquer momento.
BetFast,França x Croácia,Resultado: França / França Mais de 7.5 escanteios na partida
BetFast,Portugal x Dinamarca,Mais de 4.5 cartões e mais de 1.5 gols na partida / Resultado: Portugal ou Empate
BetFast,Ceara SC CE - Fortaleza EC CE,Mais de 0.5 cartão vermelho na partida.
BetFast,Ceara SC CE - Fortaleza EC CE,Fortaleza levanta a taça.
BetFast,"Fonseca, Joao - Humbert, Ugo",Joao Fonseca vencer a partida.
BetFast,Alemanha x Itália,Empate ou Italia / Italia Mais de 10.5 finalizações /ambos times recebem 1 ou mais cartões na partida
BetFast,Alemanha x Itália,Ambos marcam / Ambos goleiros Mais de 2.5 defesas cada
BrasilDaSorte,Atlanta Hawks x GS Warriors,GS Warriors Vence a partida / Total de Pontos: Mais de 230.5
BrasilDaSorte,Avaí FC x Chapecoense SC,Para ter 2 ou Mais Gols na Partida
BrasilDaSorte,Ceará SC x Fortaleza EC,Total de Gols: Mais de 2.5 / Total de Escanteios: Mais de 9.5 / Total de Cartões: Mais de 5.5
BrasilDaSorte,Retro FC PE x Sport Clube do Recife,Total de Gols: Mais de 2.5 / Total de Escanteios: Mais de 11.5 / Total de Cartões : Mais de 5.5
BrasilDaSorte,Tênis - ATP Miami,"Holger Rune x Reilly Opelka: Para ganhar: Rune, Holger / Bergs, Zizou x Rublev, Andrey: Para ganhar: Rublev, Andrey / Fokina, Alejandro x Tiafoe, Francis: Para ganhar: Tiafoe, Francis"
BrasilDaSorte,Joao Fonseca x Ugo Humbert,Para ganhar: JOÃO FONSECA
BrasilDaSorte,Basquete - Estados Unidos - NBA,Pacers x Nets: Para ganhar: Brooklyn Nets / A. Hawks x GS Warriors: Para ganhar: Golden State Warriors / Knicks x Wizards: Para ganhar: New York Knicks
BrasilDaSorte,Indiana Pacers x Brooklyn Nets,Indiana Pacers Vencedor / Total de Pontos: Mais de 220.5 / Total de arremessos de três pontos convertidos: Mais de 24.5
BrasilDaSorte,Joao Fonseca x Ugo Humbert,Para ganhar: Joao Fonseca / Total de Aces João Fonseca: Mais de 6.5 / Duplas Faltas: Menos de 4.5
BrasilDaSorte,Super Sorte do Dia,*Alemanha x Itália: Multi resultados: 2x1 ou 3x1 ou 4x1 / *Espanha x Países Baixos: Multi resultados: 2x1 ou 3x1 ou 4x1 / *França x Croácia: Multi resultados: 1x0 ou 2x0 ou 3x0 / *Portugal x Dinamarca: Multi resultados: 1x0 ou 2x0 ou 3x0
Faz1Bet,Vitoria BA - Bahia BA,Mais de 2.5 gols na partida / Para Bahia levantar a taça
Faz1Bet,Ceara SC CE - Fortaleza EC CE,Fortaleza levanta a taça.
Faz1Bet,Ceara SC CE - Fortaleza EC CE,Mais de 0.5 cartão vermelho na partida.
Faz1Bet,Chinese Grand Prix 2025 - Race,Gabriel Bortoleto terminar no Top 10.
BETPIX365,"UEFA Nations League, Finals",França - Croácia ambas equipes para marcar - Sim
BETPIX365,"UEFA Nations League, Finals",Almemanha - Itália ambas equipes para marcar - sim
BETPIX365,"UEFA Nations League, Finals",Espanha - Holanda ambas equipes para marcar - sim
BETPIX365,"UEFA Nations League, Finals","Portugal - Dinamarca Mais de 2,5 gols"
VAIDEBET,"UEFA Nations League, Finals",França - Croácia - França para se classificar
VAIDEBET,"UEFA Nations League, Finals","Almemanha - Itália Mais de 2,5 gols"
VAIDEBET,"UEFA Nations League, Finals",Portugal - Dinamarca - Portugal para se Classificar
VAIDEBET,"UEFA Nations League, Finals",Espanha - Holanda - Holanda para se classificar
BrasilDaSorte,Islândia x Kosovo,Mais de 3.5 chutes no gol de Kosovo / Mais de 0.5 gols de Kosovo / Mais de 1.5 cartões de Kosovo
BrasilDaSorte,Eslovénia x Eslováquia,Menos de 2.5 gols na partida / Menos de 7.5 chutes no gol na partida
BrasilDaSorte,Alemanha x Itália,Empate ou Itália / Ambos Marcam Gol / Para Sandro Tonali Marcar ou dar Assistência
BrasilDaSorte,Irlanda x Bulgária,Empate ou Bulgária vence / Mais de 0.5 gols de Bulgária / Menos de 2.5 gols de Irlanda
BrasilDaSorte,Bélgica x Ucrânia,Menos de 3.5 gols na partida / Menos de 10.5 escanteios no jogo
BrasilDaSorte,Portugal x Dinamarca,Mais de 1.5 gols de Portugal / Cristiano Ronaldo marca a qualquer momento
BrasilDaSorte,Geórgia x Arménia,Mais de 0.5 gols de Armênia / Mais de 3.5 escanteios de Armênia
BrasilDaSorte,Hungria x Turquia,Menos de 3.5 gols na partida / Menos de 5.5 cartões no jogo / Menos de 10.5 escanteios no jogo
BrasilDaSorte,Escócia x Grécia,Mais de 2.5 gols na partida / Empate ou Grécia vence
BrasilDaSorte,Sérvia x Áustria,Mais de 1.5 gols na partida / Ambas as equipes cobram mais de 3.5 escanteios
BrasilDaSorte,Espanha x Países Baixos,Mais de 3.5 chutes no gol de Países Baixos / Mais de 0.5 gols de Países Baixos / Mais de 1.5 cartões de Países Baixos
BrasilDaSorte,França x Croácia,França vence / Mais de 1.5 cartões de França / Mais de 4.5 escanteios de França
SportingBet,Palmeiras (Feminino) - RB Bragantino (Feminino),Palmeiras ganha por 2 ou mais gols
SportingBet,República Tcheca - Ilhas Faroe,República Tcheca vence o Primeiro Tempo e a Partida
SportingBet,Palmeiras (Feminino) - RB Bragantino (Feminino),Palmeiras (Feminino) vence e ambas as equipes marcam
SportingBet,Palmeiras (Feminino) - RB Bragantino (Feminino),"Palmeiras (Feminino) vence, mais de 3,5 gols e ambas as equipes marcam"
SportingBet,ATP Masters Miami 2025 - Cotas aumentadas,J. Fonseca vence U. Humbert por 2-0
SportingBet,NBA - Cotas Aumentadas,"New York Knicks, Sacramento Kings e Los Angeles Lakers vencem - Cotas Aumentadas"
SportingBet,NBA - Cotas Aumentadas,Indiana Pacers e Golden State Warriors vencem - Cotas Aumentadas
SportingBet,Santa Fe - Millionarios,"Mais de 3,5 - Total de Gols"
BrasilDaSorte,França x Croácia,Para França MARCAR 2 Gols ou mais
BrasilDaSorte,Avai x Chapecoense,Para ter 1 Minuto ou Mais de Acréscimos no 1° Tempo
